Gene_set,Term,Overlap,P-value,Adjusted P-value,Old P-value,Old Adjusted P-value,Odds Ratio,Combined Score,Genes
GO_Biological_Process_2021,negative regulation of cellular response to insulin stimulus (GO:1900077),1/28,0.2960345410422617,0.4298521501549954,0,0,2.9456391875746712,3.5856651333362244,PTPRE
GO_Biological_Process_2021,ventricular septum morphogenesis (GO:0060412),1/28,0.2960345410422617,0.4298521501549954,0,0,2.9456391875746712,3.5856651333362244,NOTCH1
GO_Biological_Process_2021,cellular response to epidermal growth factor stimulus (GO:0071364),1/28,0.2960345410422617,0.4298521501549954,0,0,2.9456391875746712,3.5856651333362244,IQGAP1
GO_Biological_Process_2021,carbohydrate derivative biosynthetic process (GO:1901137),1/28,0.2960345410422617,0.4298521501549954,0,0,2.9456391875746712,3.5856651333362244,ALG2
GO_Biological_Process_2021,"negative regulation of transcription, DNA-templated (GO:0045892)",14/948,0.2939089434386293,0.4298521501549954,0,0,1.2002278008109708,1.4696612697115237,RB1;TCERG1;SP100;BATF3;NOTCH1;MBD2;DICER1;RBPJ;CDC73;GATAD2A;CALR;ZBTB7B;GAS6;LYAR
GO_Biological_Process_2021,transcription by RNA polymerase III (GO:0006383),1/28,0.2960345410422617,0.4298521501549954,0,0,2.9456391875746712,3.5856651333362244,ELL
GO_Biological_Process_2021,T cell activation involved in immune response (GO:0002286),1/28,0.2960345410422617,0.4298521501549954,0,0,2.9456391875746712,3.5856651333362244,LILRB1
GO_Biological_Process_2021,positive regulation of cell motility (GO:2000147),4/221,0.2966046302851612,0.4303496629597585,0,0,1.4696887049750775,1.7861938660990078,CCR1;CD151;NOTCH1;HSPA5
GO_Biological_Process_2021,metal ion transport (GO:0030001),2/88,0.2996414004154685,0.4340899920260845,0,0,1.851520572450805,2.2313949213726167,CCR1;MMGT1
GO_Biological_Process_2021,negative regulation of binding (GO:0051100),2/88,0.2996414004154685,0.4340899920260845,0,0,1.851520572450805,2.2313949213726167,SP100;GTPBP4
GO_Biological_Process_2021,positive regulation of protein kinase activity (GO:0045860),3/154,0.3007056793972589,0.4352985045291613,0,0,1.5829429817476983,1.9021011724662205,IQGAP1;GAS6;STK3
GO_Biological_Process_2021,beta-catenin-TCF complex assembly (GO:1904837),1/29,0.3048111846448894,0.4358284952445931,0,0,2.8402937788018434,3.374447268365372,CDC73
GO_Biological_Process_2021,second-messenger-mediated signaling (GO:0019932),2/89,0.3042386236994348,0.4358284952445931,0,0,1.8301456559169809,2.177768900792992,CCR1;TPCN2
GO_Biological_Process_2021,regulation of endothelial cell migration (GO:0010594),2/89,0.3042386236994348,0.4358284952445931,0,0,1.8301456559169809,2.177768900792992,SP100;CALR
GO_Biological_Process_2021,aggrephagy (GO:0035973),1/29,0.3048111846448894,0.4358284952445931,0,0,2.8402937788018434,3.374447268365372,WDFY3
GO_Biological_Process_2021,post-Golgi vesicle-mediated transport (GO:0006892),2/89,0.3042386236994348,0.4358284952445931,0,0,1.8301456559169809,2.177768900792992,VAMP8;CLTC
GO_Biological_Process_2021,regulation of double-strand break repair via nonhomologous end joining (GO:2001032),1/29,0.3048111846448894,0.4358284952445931,0,0,2.8402937788018434,3.374447268365372,DTX3L
GO_Biological_Process_2021,production of miRNAs involved in gene silencing by miRNA (GO:0035196),1/29,0.3048111846448894,0.4358284952445931,0,0,2.8402937788018434,3.374447268365372,DICER1
GO_Biological_Process_2021,regulation of fatty acid biosynthetic process (GO:0042304),1/29,0.3048111846448894,0.4358284952445931,0,0,2.8402937788018434,3.374447268365372,APOC1
GO_Biological_Process_2021,regulation of gluconeogenesis (GO:0006111),1/29,0.3048111846448894,0.4358284952445931,0,0,2.8402937788018434,3.374447268365372,SELENOS
GO_Biological_Process_2021,determination of bilateral symmetry (GO:0009855),1/29,0.3048111846448894,0.4358284952445931,0,0,2.8402937788018434,3.374447268365372,NOTCH1
GO_Biological_Process_2021,negative regulation of mRNA catabolic process (GO:1902373),1/29,0.3048111846448894,0.4358284952445931,0,0,2.8402937788018434,3.374447268365372,NOCT
GO_Biological_Process_2021,MyD88-dependent toll-like receptor signaling pathway (GO:0002755),1/29,0.3048111846448894,0.4358284952445931,0,0,2.8402937788018434,3.374447268365372,LY96
GO_Biological_Process_2021,regulation of T cell mediated cytotoxicity (GO:0001914),1/29,0.3048111846448894,0.4358284952445931,0,0,2.8402937788018434,3.374447268365372,LILRB1
GO_Biological_Process_2021,mismatch repair (GO:0006298),1/29,0.3048111846448894,0.4358284952445931,0,0,2.8402937788018434,3.374447268365372,TDG
GO_Biological_Process_2021,regulation of I-kappaB kinase/NF-kappaB signaling (GO:0043122),4/224,0.3049878053402967,0.4358284952445931,0,0,1.4494248608534324,1.7211680859755634,BST2;TNIP2;NEK6;TNFRSF1A
GO_Biological_Process_2021,negative regulation of myeloid leukocyte differentiation (GO:0002762),1/29,0.3048111846448894,0.4358284952445931,0,0,2.8402937788018434,3.374447268365372,C1QC
GO_Biological_Process_2021,negative regulation of transferase activity (GO:0051348),1/29,0.3048111846448894,0.4358284952445931,0,0,2.8402937788018434,3.374447268365372,DTX3L
GO_Biological_Process_2021,"positive regulation of transcription, DNA-templated (GO:0045893)",17/1183,0.3055088545633952,0.4362435870444858,0,0,1.167951883835098,1.3849299167787177,TCERG1;SP100;NOTCH1;ELL;DTX3L;FHOD1;HEATR1;LILRB1;RBPJ;AATF;WDR43;TNFRSF1A;ASXL1;TNIP2;NCK2;E2F4;LYAR
GO_Biological_Process_2021,positive regulation of binding (GO:0051099),2/90,0.3088304106233074,0.4406539493961521,0,0,1.8092565329407435,2.125809457809797,DTX3L;STK3
GO_Biological_Process_2021,multivesicular body assembly (GO:0036258),1/30,0.3134788398667338,0.4409680037381861,0,0,2.742213570634038,3.1810319580645494,VPS37A
GO_Biological_Process_2021,positive regulation of endopeptidase activity (GO:0010950),1/30,0.3134788398667338,0.4409680037381861,0,0,2.742213570634038,3.1810319580645494,PSME2
GO_Biological_Process_2021,TRIF-dependent toll-like receptor signaling pathway (GO:0035666),1/30,0.3134788398667338,0.4409680037381861,0,0,2.742213570634038,3.1810319580645494,LY96
GO_Biological_Process_2021,snRNA 3'-end processing (GO:0034472),1/30,0.3134788398667338,0.4409680037381861,0,0,2.742213570634038,3.1810319580645494,INTS6
GO_Biological_Process_2021,ion homeostasis (GO:0050801),1/30,0.3134788398667338,0.4409680037381861,0,0,2.742213570634038,3.1810319580645494,WNK1
GO_Biological_Process_2021,maintenance of blood-brain barrier (GO:0035633),1/30,0.3134788398667338,0.4409680037381861,0,0,2.742213570634038,3.1810319580645494,MFSD2A
GO_Biological_Process_2021,regulation of actin cytoskeleton organization (GO:0032956),2/91,0.3134161857231889,0.4409680037381861,0,0,1.7888368284583542,2.0754501768956306,BST2;IQGAP1
GO_Biological_Process_2021,CENP-A containing chromatin organization (GO:0061641),1/30,0.3134788398667338,0.4409680037381861,0,0,2.742213570634038,3.1810319580645494,NASP
GO_Biological_Process_2021,cell projection organization (GO:0030030),1/30,0.3134788398667338,0.4409680037381861,0,0,2.742213570634038,3.1810319580645494,SCIN
GO_Biological_Process_2021,regulation of cation transmembrane transport (GO:1904062),1/30,0.3134788398667338,0.4409680037381861,0,0,2.742213570634038,3.1810319580645494,WNK1
GO_Biological_Process_2021,artery morphogenesis (GO:0048844),1/30,0.3134788398667338,0.4409680037381861,0,0,2.742213570634038,3.1810319580645494,NOTCH1
GO_Biological_Process_2021,CENP-A containing nucleosome assembly (GO:0034080),1/30,0.3134788398667338,0.4409680037381861,0,0,2.742213570634038,3.1810319580645494,NASP
GO_Biological_Process_2021,chondroitin sulfate metabolic process (GO:0030204),1/30,0.3134788398667338,0.4409680037381861,0,0,2.742213570634038,3.1810319580645494,CHST11
GO_Biological_Process_2021,ncRNA catabolic process (GO:0034661),1/30,0.3134788398667338,0.4409680037381861,0,0,2.742213570634038,3.1810319580645494,NUDT16
GO_Biological_Process_2021,negative regulation of interleukin-1 production (GO:0032692),1/30,0.3134788398667338,0.4409680037381861,0,0,2.742213570634038,3.1810319580645494,GAS6
GO_Biological_Process_2021,regulation of protein localization to membrane (GO:1905475),1/30,0.3134788398667338,0.4409680037381861,0,0,2.742213570634038,3.1810319580645494,VAMP8
GO_Biological_Process_2021,regulation of macrophage activation (GO:0043030),1/30,0.3134788398667338,0.4409680037381861,0,0,2.742213570634038,3.1810319580645494,TNIP2
GO_Biological_Process_2021,establishment of spindle orientation (GO:0051294),1/30,0.3134788398667338,0.4409680037381861,0,0,2.742213570634038,3.1810319580645494,MAP4
GO_Biological_Process_2021,respiratory tube development (GO:0030323),1/30,0.3134788398667338,0.4409680037381861,0,0,2.742213570634038,3.1810319580645494,CHI3L1
GO_Biological_Process_2021,positive regulation of transmembrane receptor protein serine/threonine kinase signaling pathway (GO:0090100),2/92,0.3179953885503533,0.4457187366732573,0,0,1.7688708951866847,2.0266279278087582,NOTCH1;RBPJ
GO_Biological_Process_2021,regulation of developmental growth (GO:0048638),1/31,0.3220388546682572,0.4457187366732573,0,0,2.650672043010753,3.0034316267817784,MFSD2A
GO_Biological_Process_2021,vitamin transport (GO:0051180),1/31,0.3220388546682572,0.4457187366732573,0,0,2.650672043010753,3.0034316267817784,SLC52A2
GO_Biological_Process_2021,T cell activation (GO:0042110),2/92,0.3179953885503533,0.4457187366732573,0,0,1.7688708951866847,2.0266279278087582,NCK2;CTPS1
GO_Biological_Process_2021,MyD88-independent toll-like receptor signaling pathway (GO:0002756),1/31,0.3220388546682572,0.4457187366732573,0,0,2.650672043010753,3.0034316267817784,LY96
GO_Biological_Process_2021,negative regulation of DNA binding (GO:0043392),1/31,0.3220388546682572,0.4457187366732573,0,0,2.650672043010753,3.0034316267817784,SP100
GO_Biological_Process_2021,multivesicular body organization (GO:0036257),1/31,0.3220388546682572,0.4457187366732573,0,0,2.650672043010753,3.0034316267817784,VPS37A
GO_Biological_Process_2021,negative regulation of proteasomal ubiquitin-dependent protein catabolic process (GO:0032435),1/31,0.3220388546682572,0.4457187366732573,0,0,2.650672043010753,3.0034316267817784,EIF3H
GO_Biological_Process_2021,regulation of cellular senescence (GO:2000772),1/31,0.3220388546682572,0.4457187366732573,0,0,2.650672043010753,3.0034316267817784,NEK6
GO_Biological_Process_2021,receptor signaling pathway via JAK-STAT (GO:0007259),1/31,0.3220388546682572,0.4457187366732573,0,0,2.650672043010753,3.0034316267817784,IFNAR1
GO_Biological_Process_2021,proteoglycan biosynthetic process (GO:0030166),1/31,0.3220388546682572,0.4457187366732573,0,0,2.650672043010753,3.0034316267817784,CHST11
GO_Biological_Process_2021,aminoglycan catabolic process (GO:0006026),1/31,0.3220388546682572,0.4457187366732573,0,0,2.650672043010753,3.0034316267817784,CHI3L1
GO_Biological_Process_2021,activation of protein kinase B activity (GO:0032148),1/31,0.3220388546682572,0.4457187366732573,0,0,2.650672043010753,3.0034316267817784,GAS6
GO_Biological_Process_2021,mRNA processing (GO:0006397),5/300,0.3188074297404797,0.4457187366732573,0,0,1.351486524034454,1.5449761832024749,TCERG1;RNGTT;HNRNPF;DHX15;GTF2F2
GO_Biological_Process_2021,phospholipid translocation (GO:0045332),1/31,0.3220388546682572,0.4457187366732573,0,0,2.650672043010753,3.0034316267817784,MFSD2A
GO_Biological_Process_2021,positive regulation of RNA splicing (GO:0033120),1/31,0.3220388546682572,0.4457187366732573,0,0,2.650672043010753,3.0034316267817784,RBM3
GO_Biological_Process_2021,negative regulation of response to DNA damage stimulus (GO:2001021),1/31,0.3220388546682572,0.4457187366732573,0,0,2.650672043010753,3.0034316267817784,BCL2L1
GO_Biological_Process_2021,positive regulation of protein targeting to mitochondrion (GO:1903955),1/31,0.3220388546682572,0.4457187366732573,0,0,2.650672043010753,3.0034316267817784,SH3GLB1
GO_Biological_Process_2021,positive regulation of ubiquitin-protein transferase activity (GO:0051443),1/31,0.3220388546682572,0.4457187366732573,0,0,2.650672043010753,3.0034316267817784,RPS2
GO_Biological_Process_2021,negative regulation of response to biotic stimulus (GO:0002832),1/31,0.3220388546682572,0.4457187366732573,0,0,2.650672043010753,3.0034316267817784,LYAR
GO_Biological_Process_2021,phosphatidylethanolamine metabolic process (GO:0046337),1/31,0.3220388546682572,0.4457187366732573,0,0,2.650672043010753,3.0034316267817784,PISD
GO_Biological_Process_2021,regulation of lipid metabolic process (GO:0019216),2/92,0.3179953885503533,0.4457187366732573,0,0,1.7688708951866847,2.0266279278087582,CARM1;APOC1
GO_Biological_Process_2021,positive regulation of peptidyl-serine phosphorylation (GO:0033138),2/93,0.3225674734711,0.4457981444903734,0,0,1.7493437736352715,1.9792826702972024,ARAF;GAS6
GO_Biological_Process_2021,cytoplasmic translation (GO:0002181),2/93,0.3225674734711,0.4457981444903734,0,0,1.7493437736352715,1.9792826702972024,RPS2;RPL17
GO_Biological_Process_2021,positive regulation of protein kinase B signaling (GO:0051897),3/161,0.3245209606900973,0.4481705530114336,0,0,1.5122723062673664,1.7019190433662823,CHI3L1;GRB2;GAS6
GO_Biological_Process_2021,chromatin remodeling at centromere (GO:0031055),1/32,0.330492560538441,0.4495269047726316,0,0,2.565036420395421,2.83993427119085,NASP
GO_Biological_Process_2021,positive regulation of epithelial cell migration (GO:0010634),2/94,0.3271319093035934,0.4495269047726316,0,0,1.7302411547262806,1.9333572732267348,CALR;ARF6
GO_Biological_Process_2021,cellular response to topologically incorrect protein (GO:0035967),1/32,0.330492560538441,0.4495269047726316,0,0,2.565036420395421,2.83993427119085,HSPA5
GO_Biological_Process_2021,regulation of cell morphogenesis (GO:0022604),1/32,0.330492560538441,0.4495269047726316,0,0,2.565036420395421,2.83993427119085,MFSD2A
GO_Biological_Process_2021,cardiac muscle tissue morphogenesis (GO:0055008),1/32,0.330492560538441,0.4495269047726316,0,0,2.565036420395421,2.83993427119085,NOTCH1
GO_Biological_Process_2021,regulation of cell migration involved in sprouting angiogenesis (GO:0090049),1/32,0.330492560538441,0.4495269047726316,0,0,2.565036420395421,2.83993427119085,NOTCH1
GO_Biological_Process_2021,endodermal cell differentiation (GO:0035987),1/32,0.330492560538441,0.4495269047726316,0,0,2.565036420395421,2.83993427119085,CDC73
GO_Biological_Process_2021,negative regulation of intracellular steroid hormone receptor signaling pathway (GO:0033144),1/32,0.330492560538441,0.4495269047726316,0,0,2.565036420395421,2.83993427119085,CALR
GO_Biological_Process_2021,negative regulation of chemotaxis (GO:0050922),1/32,0.330492560538441,0.4495269047726316,0,0,2.565036420395421,2.83993427119085,NOTCH1
GO_Biological_Process_2021,activation of phospholipase C activity (GO:0007202),1/32,0.330492560538441,0.4495269047726316,0,0,2.565036420395421,2.83993427119085,GNAQ
GO_Biological_Process_2021,ERBB2 signaling pathway (GO:0038128),1/32,0.330492560538441,0.4495269047726316,0,0,2.565036420395421,2.83993427119085,GRB2
GO_Biological_Process_2021,gene silencing by miRNA (GO:0035195),1/32,0.330492560538441,0.4495269047726316,0,0,2.565036420395421,2.83993427119085,DICER1
GO_Biological_Process_2021,liver development (GO:0001889),1/32,0.330492560538441,0.4495269047726316,0,0,2.565036420395421,2.83993427119085,PCK2
GO_Biological_Process_2021,long-chain fatty acid transport (GO:0015909),1/32,0.330492560538441,0.4495269047726316,0,0,2.565036420395421,2.83993427119085,MFSD2A
GO_Biological_Process_2021,positive regulation of receptor signaling pathway via STAT (GO:1904894),1/32,0.330492560538441,0.4495269047726316,0,0,2.565036420395421,2.83993427119085,NOTCH1
GO_Biological_Process_2021,modulation by host of symbiont process (GO:0051851),1/32,0.330492560538441,0.4495269047726316,0,0,2.565036420395421,2.83993427119085,CTDP1
GO_Biological_Process_2021,positive regulation of immune effector process (GO:0002699),1/32,0.330492560538441,0.4495269047726316,0,0,2.565036420395421,2.83993427119085,LILRB1
GO_Biological_Process_2021,positive regulation of telomere maintenance (GO:0032206),1/32,0.330492560538441,0.4495269047726316,0,0,2.565036420395421,2.83993427119085,GNL3
GO_Biological_Process_2021,mitochondrial membrane organization (GO:0007006),1/32,0.330492560538441,0.4495269047726316,0,0,2.565036420395421,2.83993427119085,BCL2L1
GO_Biological_Process_2021,regulation of transcription involved in G1/S transition of mitotic cell cycle (GO:0000083),1/32,0.330492560538441,0.4495269047726316,0,0,2.565036420395421,2.83993427119085,RB1
GO_Biological_Process_2021,regulation of intracellular estrogen receptor signaling pathway (GO:0033146),1/32,0.330492560538441,0.4495269047726316,0,0,2.565036420395421,2.83993427119085,CARM1
GO_Biological_Process_2021,protein ubiquitination (GO:0016567),8/525,0.3311707020289898,0.4501256955738855,0,0,1.2349575029896387,1.364777866392741,PSMA5;SELENOS;DTX3L;PSMD1;PSME2;UBR1;CDC73;UBE2J1
GO_Biological_Process_2021,positive regulation of telomere maintenance via telomerase (GO:0032212),1/33,0.3388412724108257,0.4549948100789796,0,0,2.4847530241935485,2.6890581249868664,CCT6A
GO_Biological_Process_2021,adenylate cyclase-modulating G protein-coupled receptor signaling pathway (GO:0007188),3/165,0.3381375200846859,0.4549948100789796,0,0,1.4746311352002408,1.5989463770205807,ADGRG1;GPR65;GNAQ
GO_Biological_Process_2021,cellular transition metal ion homeostasis (GO:0046916),2/96,0.3362357799258719,0.4549948100789796,0,0,1.6932552330088724,1.845551077409442,SLC31A2;SLC11A2
GO_Biological_Process_2021,muscle cell development (GO:0055001),1/33,0.3388412724108257,0.4549948100789796,0,0,2.4847530241935485,2.6890581249868664,BIN1
GO_Biological_Process_2021,negative regulation of JNK cascade (GO:0046329),1/33,0.3388412724108257,0.4549948100789796,0,0,2.4847530241935485,2.6890581249868664,HIPK3
GO_Biological_Process_2021,apoptotic cell clearance (GO:0043277),1/33,0.3388412724108257,0.4549948100789796,0,0,2.4847530241935485,2.6890581249868664,GAS6
GO_Biological_Process_2021,actin filament bundle assembly (GO:0051017),1/33,0.3388412724108257,0.4549948100789796,0,0,2.4847530241935485,2.6890581249868664,HSP90B1
GO_Biological_Process_2021,phosphatidylcholine biosynthetic process (GO:0006656),1/33,0.3388412724108257,0.4549948100789796,0,0,2.4847530241935485,2.6890581249868664,MFSD2A
GO_Biological_Process_2021,positive regulation of histone modification (GO:0031058),1/33,0.3388412724108257,0.4549948100789796,0,0,2.4847530241935485,2.6890581249868664,ZBTB7B
GO_Biological_Process_2021,positive regulation of receptor signaling pathway via JAK-STAT (GO:0046427),1/33,0.3388412724108257,0.4549948100789796,0,0,2.4847530241935485,2.6890581249868664,NOTCH1
GO_Biological_Process_2021,RNA stabilization (GO:0043489),1/33,0.3388412724108257,0.4549948100789796,0,0,2.4847530241935485,2.6890581249868664,NOCT
GO_Biological_Process_2021,lytic vacuole organization (GO:0080171),1/33,0.3388412724108257,0.4549948100789796,0,0,2.4847530241935485,2.6890581249868664,TPCN2
GO_Biological_Process_2021,vasculogenesis (GO:0001570),1/33,0.3388412724108257,0.4549948100789796,0,0,2.4847530241935485,2.6890581249868664,NOTCH1
GO_Biological_Process_2021,regulation of interleukin-17 production (GO:0032660),1/33,0.3388412724108257,0.4549948100789796,0,0,2.4847530241935485,2.6890581249868664,ZBTB7B
GO_Biological_Process_2021,signal transduction by p53 class mediator (GO:0072331),1/33,0.3388412724108257,0.4549948100789796,0,0,2.4847530241935485,2.6890581249868664,RRP8
GO_Biological_Process_2021,apoptotic mitochondrial changes (GO:0008637),1/33,0.3388412724108257,0.4549948100789796,0,0,2.4847530241935485,2.6890581249868664,BCL2L1
GO_Biological_Process_2021,neuron projection extension (GO:1990138),1/33,0.3388412724108257,0.4549948100789796,0,0,2.4847530241935485,2.6890581249868664,IQGAP1
GO_Biological_Process_2021,protein maturation (GO:0051604),2/97,0.3407742224753839,0.4572658361159052,0,0,1.6753462603878115,1.8035690961198845,DNAJB11;TSPAN33
GO_Biological_Process_2021,positive regulation of pri-miRNA transcription by RNA polymerase II (GO:1902895),1/34,0.3470862891794709,0.4576217833641526,0,0,2.4093352883675463,2.5495148918983825,GNL3
GO_Biological_Process_2021,positive regulation of DNA binding (GO:0043388),1/34,0.3470862891794709,0.4576217833641526,0,0,2.4093352883675463,2.5495148918983825,RB1
GO_Biological_Process_2021,positive regulation of protein dephosphorylation (GO:0035307),1/34,0.3470862891794709,0.4576217833641526,0,0,2.4093352883675463,2.5495148918983825,CD300A
GO_Biological_Process_2021,protein destabilization (GO:0031648),1/34,0.3470862891794709,0.4576217833641526,0,0,2.4093352883675463,2.5495148918983825,CDC73
GO_Biological_Process_2021,sister chromatid segregation (GO:0000819),1/34,0.3470862891794709,0.4576217833641526,0,0,2.4093352883675463,2.5495148918983825,RB1
GO_Biological_Process_2021,cellular response to amino acid stimulus (GO:0071230),1/34,0.3470862891794709,0.4576217833641526,0,0,2.4093352883675463,2.5495148918983825,UBR1
GO_Biological_Process_2021,phosphatidylserine metabolic process (GO:0006658),1/34,0.3470862891794709,0.4576217833641526,0,0,2.4093352883675463,2.5495148918983825,PTDSS1
GO_Biological_Process_2021,tRNA export from nucleus (GO:0006409),1/34,0.3470862891794709,0.4576217833641526,0,0,2.4093352883675463,2.5495148918983825,SEH1L
GO_Biological_Process_2021,protein localization to chromosome (GO:0034502),1/34,0.3470862891794709,0.4576217833641526,0,0,2.4093352883675463,2.5495148918983825,RB1
GO_Biological_Process_2021,regulation of transmembrane transport (GO:0034762),1/34,0.3470862891794709,0.4576217833641526,0,0,2.4093352883675463,2.5495148918983825,KCNJ5
GO_Biological_Process_2021,histone lysine methylation (GO:0034968),1/34,0.3470862891794709,0.4576217833641526,0,0,2.4093352883675463,2.5495148918983825,SETD6
GO_Biological_Process_2021,tRNA-containing ribonucleoprotein complex export from nucleus (GO:0071431),1/34,0.3470862891794709,0.4576217833641526,0,0,2.4093352883675463,2.5495148918983825,SEH1L
GO_Biological_Process_2021,negative regulation of blood vessel endothelial cell migration (GO:0043537),1/34,0.3470862891794709,0.4576217833641526,0,0,2.4093352883675463,2.5495148918983825,NOTCH1
GO_Biological_Process_2021,organic cyclic compound biosynthetic process (GO:1901362),1/34,0.3470862891794709,0.4576217833641526,0,0,2.4093352883675463,2.5495148918983825,PYCR1
GO_Biological_Process_2021,regulation of glucose metabolic process (GO:0010906),1/34,0.3470862891794709,0.4576217833641526,0,0,2.4093352883675463,2.5495148918983825,SELENOS
GO_Biological_Process_2021,regulation of myoblast differentiation (GO:0045661),1/34,0.3470862891794709,0.4576217833641526,0,0,2.4093352883675463,2.5495148918983825,NOTCH1
GO_Biological_Process_2021,cellular response to vascular endothelial growth factor stimulus (GO:0035924),1/34,0.3470862891794709,0.4576217833641526,0,0,2.4093352883675463,2.5495148918983825,NOTCH1
GO_Biological_Process_2021,autophagosome maturation (GO:0097352),1/34,0.3470862891794709,0.4576217833641526,0,0,2.4093352883675463,2.5495148918983825,VAMP8
GO_Biological_Process_2021,cell-substrate junction assembly (GO:0007044),1/34,0.3470862891794709,0.4576217833641526,0,0,2.4093352883675463,2.5495148918983825,CD151
GO_Biological_Process_2021,regulation of amyloid-beta formation (GO:1902003),1/34,0.3470862891794709,0.4576217833641526,0,0,2.4093352883675463,2.5495148918983825,BIN1
GO_Biological_Process_2021,antigen processing and presentation of exogenous peptide antigen via MHC class II (GO:0019886),2/98,0.3453030308279757,0.4576217833641526,0,0,1.6578103913630229,1.7628043265368574,CLTC;SEC31A
GO_Biological_Process_2021,regulation of ERK1 and ERK2 cascade (GO:0070372),4/238,0.3443762517730726,0.4576217833641526,0,0,1.3617303331589046,1.4516324018268325,CCR1;NOTCH1;CHI3L1;GAS6
GO_Biological_Process_2021,positive regulation of macromolecule metabolic process (GO:0010604),6/384,0.344993823769709,0.4576217833641526,0,0,1.2654647592919197,1.3467439969550798,NOTCH1;DTX3L;LILRB1;RBPJ;ZBTB7B;GAS6
GO_Biological_Process_2021,negative regulation of mitochondrion organization (GO:0010823),1/34,0.3470862891794709,0.4576217833641526,0,0,2.4093352883675463,2.5495148918983825,BCL2L1
GO_Biological_Process_2021,negative regulation of extrinsic apoptotic signaling pathway via death domain receptors (GO:1902042),1/34,0.3470862891794709,0.4576217833641526,0,0,2.4093352883675463,2.5495148918983825,BCL2L1
GO_Biological_Process_2021,organic anion transport (GO:0015711),2/99,0.3498217422895281,0.4608510733734982,0,0,1.6406360866480236,1.723211863536543,SLC35B1;SLC52A2
GO_Biological_Process_2021,axonogenesis (GO:0007409),4/240,0.3500227232757488,0.4608510733734982,0,0,1.350051885160844,1.4172266908188478,LYPLA2;SPTBN5;NOTCH1;GRB2
GO_Biological_Process_2021,protein polyubiquitination (GO:0000209),5/314,0.3531694982390028,0.4609691815252397,0,0,1.2893256936707518,1.3419394294136944,PSMA5;DTX3L;PSMD1;PSME2;UBE2J1
GO_Biological_Process_2021,acylglycerol catabolic process (GO:0046464),1/35,0.3552288935855177,0.4609691815252397,0,0,2.338353889943074,2.420179736022143,LYPLA2
GO_Biological_Process_2021,antigen processing and presentation of peptide antigen via MHC class II (GO:0002495),2/100,0.3543299070983733,0.4609691815252397,0,0,1.6238122779476163,1.6847488521495495,CLTC;SEC31A
GO_Biological_Process_2021,lung development (GO:0030324),1/35,0.3552288935855177,0.4609691815252397,0,0,2.338353889943074,2.420179736022143,CHI3L1
GO_Biological_Process_2021,regulation of autophagosome assembly (GO:2000785),1/35,0.3552288935855177,0.4609691815252397,0,0,2.338353889943074,2.420179736022143,SH3GLB1
GO_Biological_Process_2021,intracellular pH reduction (GO:0051452),1/35,0.3552288935855177,0.4609691815252397,0,0,2.338353889943074,2.420179736022143,TCIRG1
GO_Biological_Process_2021,"base-excision repair, gap-filling (GO:0006287)",1/35,0.3552288935855177,0.4609691815252397,0,0,2.338353889943074,2.420179736022143,TDG
