Gene_set,Term,Overlap,P-value,Adjusted P-value,Old P-value,Old Adjusted P-value,Odds Ratio,Combined Score,Genes
GO_Biological_Process_2021,cell junction organization (GO:0034330),1/72,0.1889904250257408,0.2457482449078369,0,0,4.910056832221398,8.180444014676121,VMP1
GO_Biological_Process_2021,negative regulation of cell adhesion (GO:0007162),1/73,0.1913508469464668,0.2457482449078369,0,0,4.841617933723197,8.006325232895135,TGFBI
GO_Biological_Process_2021,endoplasmic reticulum organization (GO:0007029),1/73,0.1913508469464668,0.2457482449078369,0,0,4.841617933723197,8.006325232895135,VAPA
GO_Biological_Process_2021,positive regulation of synaptic transmission (GO:0050806),1/73,0.1913508469464668,0.2457482449078369,0,0,4.841617933723197,8.006325232895135,STX4
GO_Biological_Process_2021,regulation of hydrolase activity (GO:0051336),1/73,0.1913508469464668,0.2457482449078369,0,0,4.841617933723197,8.006325232895135,FBXW11
GO_Biological_Process_2021,cytoskeleton-dependent cytokinesis (GO:0061640),1/72,0.1889904250257408,0.2457482449078369,0,0,4.910056832221398,8.180444014676121,CHMP4B
GO_Biological_Process_2021,regulation of Rho protein signal transduction (GO:0035023),1/73,0.1913508469464668,0.2457482449078369,0,0,4.841617933723197,8.006325232895135,F11R
GO_Biological_Process_2021,positive regulation of secretion by cell (GO:1903532),1/72,0.1889904250257408,0.2457482449078369,0,0,4.910056832221398,8.180444014676121,RAB27A
GO_Biological_Process_2021,response to ionizing radiation (GO:0010212),1/72,0.1889904250257408,0.2457482449078369,0,0,4.910056832221398,8.180444014676121,CDKN1A
GO_Biological_Process_2021,insulin receptor signaling pathway (GO:0008286),1/73,0.1913508469464668,0.2457482449078369,0,0,4.841617933723197,8.006325232895135,NAMPT
GO_Biological_Process_2021,negative regulation of protein binding (GO:0032091),1/74,0.1937045170030888,0.2458926761295409,0,0,4.775054073540014,7.837875891175932,CDKN1A
GO_Biological_Process_2021,mitotic nuclear division (GO:0140014),1/74,0.1937045170030888,0.2458926761295409,0,0,4.775054073540014,7.837875891175932,CHMP4B
GO_Biological_Process_2021,proteolysis involved in cellular protein catabolic process (GO:0051603),1/74,0.1937045170030888,0.2458926761295409,0,0,4.775054073540014,7.837875891175932,CHMP4B
GO_Biological_Process_2021,"DNA damage response, signal transduction by p53 class mediator (GO:0030330)",1/74,0.1937045170030888,0.2458926761295409,0,0,4.775054073540014,7.837875891175932,CDKN1A
GO_Biological_Process_2021,NIK/NF-kappaB signaling (GO:0038061),1/74,0.1937045170030888,0.2458926761295409,0,0,4.775054073540014,7.837875891175932,FBXW11
GO_Biological_Process_2021,sphingolipid biosynthetic process (GO:0030148),1/74,0.1937045170030888,0.2458926761295409,0,0,4.775054073540014,7.837875891175932,VAPA
GO_Biological_Process_2021,cellular response to amino acid starvation (GO:0034198),1/74,0.1937045170030888,0.2458926761295409,0,0,4.775054073540014,7.837875891175932,CDKN1A
GO_Biological_Process_2021,protein ubiquitination (GO:0016567),3/525,0.1949989599069859,0.247127394733606,0,0,2.0292580982236155,3.317352107983068,RNF144B;FBXW11;UBE2D3
GO_Biological_Process_2021,positive regulation of immune response (GO:0050778),1/75,0.1960514542139784,0.2476439421650254,0,0,4.710289236605026,7.674842280837456,STX4
GO_Biological_Process_2021,response to amino acid starvation (GO:1990928),1/75,0.1960514542139784,0.2476439421650254,0,0,4.710289236605026,7.674842280837456,CDKN1A
GO_Biological_Process_2021,actomyosin structure organization (GO:0031032),1/76,0.1983916774913417,0.2497783742841811,0,0,4.647251461988304,7.516985160791354,F11R
GO_Biological_Process_2021,regulation of BMP signaling pathway (GO:0030510),1/76,0.1983916774913417,0.2497783742841811,0,0,4.647251461988304,7.516985160791354,UBE2D3
GO_Biological_Process_2021,purine ribonucleotide metabolic process (GO:0009150),1/77,0.2007252056818943,0.2506617202661705,0,0,4.585872576177286,7.3640787564824945,AMPD2
GO_Biological_Process_2021,cholesterol metabolic process (GO:0008203),1/77,0.2007252056818943,0.2506617202661705,0,0,4.585872576177286,7.3640787564824945,PPARD
GO_Biological_Process_2021,cellular response to UV (GO:0034644),1/77,0.2007252056818943,0.2506617202661705,0,0,4.585872576177286,7.3640787564824945,CDKN1A
GO_Biological_Process_2021,neutrophil migration (GO:1990266),1/77,0.2007252056818943,0.2506617202661705,0,0,4.585872576177286,7.3640787564824945,FCER1G
GO_Biological_Process_2021,positive regulation of type I interferon production (GO:0032481),1/77,0.2007252056818943,0.2506617202661705,0,0,4.585872576177286,7.3640787564824945,IRF1
GO_Biological_Process_2021,antigen processing and presentation of exogenous peptide antigen via MHC class I (GO:0042590),1/78,0.2030520576504542,0.2527455109814406,0,0,4.526087947140579,7.21590983901805,FCER1G
GO_Biological_Process_2021,protein modification process (GO:0036211),1/78,0.2030520576504542,0.2527455109814406,0,0,4.526087947140579,7.21590983901805,UBE2D3
GO_Biological_Process_2021,negative regulation of cellular response to growth factor stimulus (GO:0090288),1/80,0.2076858078344208,0.2564352096733685,0,0,4.41105929380413,6.932989285903756,UBE2D3
GO_Biological_Process_2021,response to interferon-gamma (GO:0034341),1/80,0.2076858078344208,0.2564352096733685,0,0,4.41105929380413,6.932989285903756,CD58
GO_Biological_Process_2021,regulation of organelle organization (GO:0033043),1/80,0.2076858078344208,0.2564352096733685,0,0,4.41105929380413,6.932989285903756,F11R
GO_Biological_Process_2021,regulation of fat cell differentiation (GO:0045598),1/80,0.2076858078344208,0.2564352096733685,0,0,4.41105929380413,6.932989285903756,PPARD
GO_Biological_Process_2021,positive regulation of cell adhesion (GO:0045785),1/80,0.2076858078344208,0.2564352096733685,0,0,4.41105929380413,6.932989285903756,STX4
GO_Biological_Process_2021,regulation of interleukin-8 production (GO:0032677),1/81,0.2099927434235808,0.2584526072905611,0,0,4.355701754385965,6.7978666495175535,CD58
GO_Biological_Process_2021,phospholipase C-activating G protein-coupled receptor signaling pathway (GO:0007200),1/81,0.2099927434235808,0.2584526072905611,0,0,4.355701754385965,6.7978666495175535,FPR1
GO_Biological_Process_2021,cell-cell junction organization (GO:0045216),1/82,0.2122930775184145,0.2600336260512638,0,0,4.301711067792939,6.666738118380946,NECTIN2
GO_Biological_Process_2021,regulation of cyclin-dependent protein serine/threonine kinase activity (GO:0000079),1/82,0.2122930775184145,0.2600336260512638,0,0,4.301711067792939,6.666738118380946,CDKN1A
GO_Biological_Process_2021,regulation of cell cycle (GO:0051726),2/296,0.2118588396620642,0.2600336260512638,0,0,2.3867832847424686,3.703894021834736,CDKN1A;IRF1
GO_Biological_Process_2021,regulation of defense response (GO:0031347),1/83,0.2145868286876894,0.2620074474278942,0,0,4.2490372272143775,6.539441767169585,IRF1
GO_Biological_Process_2021,regulation of interleukin-1 beta production (GO:0032651),1/83,0.2145868286876894,0.2620074474278942,0,0,4.2490372272143775,6.539441767169585,PANX1
GO_Biological_Process_2021,extracellular matrix organization (GO:0030198),2/300,0.2161149851850598,0.2634544581303586,0,0,2.354266538830297,3.606606085620694,TGFBI;F11R
GO_Biological_Process_2021,spindle assembly (GO:0051225),1/84,0.216874015426495,0.2635431073537154,0,0,4.197632635806383,6.415824035093333,CSNK1D
GO_Biological_Process_2021,lymphocyte differentiation (GO:0030098),1/84,0.216874015426495,0.2635431073537154,0,0,4.197632635806383,6.415824035093333,NFIL3
GO_Biological_Process_2021,G1/S transition of mitotic cell cycle (GO:0000082),1/85,0.2191546562278405,0.2654744100677942,0,0,4.147451963241437,6.295739200424551,CDKN1A
GO_Biological_Process_2021,regulation of cell cycle G2/M phase transition (GO:1902749),1/85,0.2191546562278405,0.2654744100677942,0,0,4.147451963241437,6.295739200424551,CSNK1D
GO_Biological_Process_2021,negative regulation of phosphorylation (GO:0042326),1/86,0.2214287694166872,0.2673856838239242,0,0,4.098452012383901,6.179048898114302,CDKN1A
GO_Biological_Process_2021,regulation of neuron death (GO:1901214),1/86,0.2214287694166872,0.2673856838239242,0,0,4.098452012383901,6.179048898114302,CHMP4B
GO_Biological_Process_2021,protein targeting to membrane (GO:0006612),1/87,0.223696373440378,0.2696998662515075,0,0,4.050591595267238,6.06562166400297,CHMP4B
GO_Biological_Process_2021,negative regulation of binding (GO:0051100),1/88,0.2259574865402732,0.2711489838483279,0,0,4.003831417624521,5.955332523032814,CDKN1A
GO_Biological_Process_2021,positive regulation of neuron projection development (GO:0010976),1/88,0.2259574865402732,0.2711489838483279,0,0,4.003831417624521,5.955332523032814,RAPGEF2
GO_Biological_Process_2021,metal ion transport (GO:0030001),1/88,0.2259574865402732,0.2711489838483279,0,0,4.003831417624521,5.955332523032814,PANX1
GO_Biological_Process_2021,transforming growth factor beta receptor signaling pathway (GO:0007179),1/89,0.2282121269940814,0.271731648885976,0,0,3.958133971291866,5.848062596467224,F11R
GO_Biological_Process_2021,regulation of type I interferon production (GO:0032479),1/89,0.2282121269940814,0.271731648885976,0,0,3.958133971291866,5.848062596467224,IRF1
GO_Biological_Process_2021,post-Golgi vesicle-mediated transport (GO:0006892),1/89,0.2282121269940814,0.271731648885976,0,0,3.958133971291866,5.848062596467224,STX4
GO_Biological_Process_2021,regulation of cysteine-type endopeptidase activity involved in apoptotic process (GO:0043281),1/89,0.2282121269940814,0.271731648885976,0,0,3.958133971291866,5.848062596467224,GRAMD4
GO_Biological_Process_2021,SCF-dependent proteasomal ubiquitin-dependent protein catabolic process (GO:0031146),1/89,0.2282121269940814,0.271731648885976,0,0,3.958133971291866,5.848062596467224,FBXW11
GO_Biological_Process_2021,positive regulation of binding (GO:0051099),1/90,0.2304603130047223,0.2739837776898247,0,0,3.9134634338655623,5.743698742935734,RAPGEF2
GO_Biological_Process_2021,toll-like receptor signaling pathway (GO:0002224),1/91,0.2327020627321415,0.2762213047577816,0,0,3.869785575048733,5.642133221925396,UBE2D3
GO_Biological_Process_2021,regulation of lipid metabolic process (GO:0019216),1/92,0.2349373942808325,0.2775875673964299,0,0,3.827067669172932,5.543263381142671,PPARD
GO_Biological_Process_2021,Wnt signaling pathway (GO:0016055),1/92,0.2349373942808325,0.2775875673964299,0,0,3.827067669172932,5.543263381142671,CSNK1A1
GO_Biological_Process_2021,negative regulation of mitotic cell cycle phase transition (GO:1901991),1/92,0.2349373942808325,0.2775875673964299,0,0,3.827067669172932,5.543263381142671,CDKN1A
GO_Biological_Process_2021,hemopoiesis (GO:0030097),1/94,0.2393888749810469,0.2824126820052903,0,0,3.744387851348802,5.353223842224764,ETV6
GO_Biological_Process_2021,regulation of cell cycle phase transition (GO:1901987),1/95,0.2416050600708842,0.2841541900986816,0,0,3.704367301231803,5.2618717526440495,CDKN1A
GO_Biological_Process_2021,ciliary basal body-plasma membrane docking (GO:0097711),1/95,0.2416050600708842,0.2841541900986816,0,0,3.704367301231803,5.2618717526440495,CSNK1D
GO_Biological_Process_2021,regulation of vesicle-mediated transport (GO:0060627),1/96,0.2438148989175783,0.2863147436830278,0,0,3.665189289012004,5.172850068462446,STX4
GO_Biological_Process_2021,cellular protein localization (GO:0034613),2/329,0.247177745187654,0.2898206233650661,0,0,2.1423110528615115,2.9941958693707487,STX4;ARFGAP3
GO_Biological_Process_2021,antigen processing and presentation of exogenous peptide antigen via MHC class II (GO:0019886),1/98,0.2482156091537258,0.2901515796500173,0,0,3.589256646771568,5.001476661240363,FCER1G
GO_Biological_Process_2021,negative regulation of neuron death (GO:1901215),1/98,0.2482156091537258,0.2901515796500173,0,0,3.589256646771568,5.001476661240363,CHMP4B
GO_Biological_Process_2021,antigen processing and presentation of peptide antigen via MHC class II (GO:0002495),1/100,0.2525911479606718,0.2943702604458208,0,0,3.5163919900762006,4.8384959983786695,FCER1G
GO_Biological_Process_2021,organic acid transport (GO:0015849),1/100,0.2525911479606718,0.2943702604458208,0,0,3.5163919900762006,4.8384959983786695,PPARD
GO_Biological_Process_2021,cellular response to chemical stress (GO:0062197),1/101,0.254769522303297,0.2955634337295047,0,0,3.4810526315789474,4.75997736286793,STX4
GO_Biological_Process_2021,positive regulation of cell cycle process (GO:0090068),1/101,0.254769522303297,0.2955634337295047,0,0,3.4810526315789474,4.75997736286793,UBXN2B
GO_Biological_Process_2021,intracellular protein transport (GO:0006886),2/336,0.2547115652091395,0.2955634337295047,0,0,2.0966638152266897,2.8674466861109345,STX4;ARFGAP3
GO_Biological_Process_2021,intrinsic apoptotic signaling pathway (GO:0097193),1/102,0.256941656798116,0.2962930817131427,0,0,3.446413062358868,4.683352202990839,CDKN1A
GO_Biological_Process_2021,mitotic sister chromatid segregation (GO:0000070),1/102,0.256941656798116,0.2962930817131427,0,0,3.446413062358868,4.683352202990839,CHMP4B
GO_Biological_Process_2021,cell junction assembly (GO:0034329),1/102,0.256941656798116,0.2962930817131427,0,0,3.446413062358868,4.683352202990839,VMP1
GO_Biological_Process_2021,positive regulation of cellular protein metabolic process (GO:0032270),1/102,0.256941656798116,0.2962930817131427,0,0,3.446413062358868,4.683352202990839,FBXW11
GO_Biological_Process_2021,cellular response to organonitrogen compound (GO:0071417),1/103,0.2591075689457492,0.2970068850005006,0,0,3.412452700378397,4.608558250965936,RAPGEF2
GO_Biological_Process_2021,antigen processing and presentation of exogenous peptide antigen (GO:0002478),1/103,0.2591075689457492,0.2970068850005006,0,0,3.412452700378397,4.608558250965936,FCER1G
GO_Biological_Process_2021,protein targeting to ER (GO:0045047),1/103,0.2591075689457492,0.2970068850005006,0,0,3.412452700378397,4.608558250965936,CHMP4B
GO_Biological_Process_2021,chromatin remodeling (GO:0006338),1/103,0.2591075689457492,0.2970068850005006,0,0,3.412452700378397,4.608558250965936,BAZ1A
GO_Biological_Process_2021,regulation of insulin secretion (GO:0050796),1/104,0.2612672762862036,0.2990361671949395,0,0,3.379151762902401,4.535535844688943,MIDN
GO_Biological_Process_2021,post-translational protein modification (GO:0043687),2/345,0.2644074404967488,0.3021799319962843,0,0,2.0407122032486464,2.714686040254963,PTP4A2;FBXW11
GO_Biological_Process_2021,positive regulation of protein serine/threonine kinase activity (GO:0071902),1/106,0.2655681464347367,0.3030554776550933,0,0,3.314452798663325,4.394579268842185,RAPGEF2
GO_Biological_Process_2021,negative regulation of transmembrane receptor protein serine/threonine kinase signaling pathway (GO:0090101),1/108,0.269844406237758,0.3065687928855003,0,0,3.2521724872929987,4.260052479988043,UBE2D3
GO_Biological_Process_2021,positive regulation of transcription by RNA polymerase II (GO:0045944),4/908,0.2691755299257002,0.3065687928855003,0,0,1.5599803343166174,2.047305062865916,IRF1;NAMPT;LITAF;PPARD
GO_Biological_Process_2021,DNA replication (GO:0006260),1/108,0.269844406237758,0.3065687928855003,0,0,3.2521724872929987,4.260052479988043,BAZ1A
GO_Biological_Process_2021,lipid transport (GO:0006869),1/109,0.2719733505870922,0.3085310683174104,0,0,3.2218973359324234,4.195075270840474,PPARD
GO_Biological_Process_2021,response to tumor necrosis factor (GO:0034612),1/110,0.2740961941893722,0.3104806447454836,0,0,3.1921776919362626,4.131559486823796,CD58
GO_Biological_Process_2021,regulation of protein serine/threonine kinase activity (GO:0071900),1/111,0.2762129542203506,0.3124175977043141,0,0,3.1629984051036684,4.069460411985225,CDKN1A
GO_Biological_Process_2021,protein-containing complex subunit organization (GO:0043933),1/112,0.2783236478478441,0.3143420022752122,0,0,3.1343448711869764,4.008735070760766,IL1RAP
GO_Biological_Process_2021,cellular response to transforming growth factor beta stimulus (GO:0071560),1/114,0.282526904021263,0.3181534637658798,0,0,3.0785592299332403,3.891241905460327,F11R
GO_Biological_Process_2021,response to lipid (GO:0033993),1/114,0.282526904021263,0.3181534637658798,0,0,3.0785592299332403,3.891241905460327,PPARD
GO_Biological_Process_2021,calcium ion transport (GO:0006816),1/115,0.2846195006637955,0.320040668389158,0,0,3.051400430901816,3.834396116557545,PANX1
GO_Biological_Process_2021,sphingolipid metabolic process (GO:0006665),1/116,0.2867060988694964,0.3209770902795529,0,0,3.0247139588100684,3.778767991259409,VAPA
GO_Biological_Process_2021,tumor necrosis factor-mediated signaling pathway (GO:0033209),1/116,0.2867060988694964,0.3209770902795529,0,0,3.0247139588100684,3.778767991259409,TNFRSF12A
GO_Biological_Process_2021,ion transport (GO:0006811),1/116,0.2867060988694964,0.3209770902795529,0,0,3.0247139588100684,3.778767991259409,PANX1
GO_Biological_Process_2021,positive regulation of cell projection organization (GO:0031346),1/117,0.2887867155808697,0.3228358043174788,0,0,2.99848759830611,3.724322111067222,RAPGEF2
GO_Biological_Process_2021,adenylate cyclase-activating G protein-coupled receptor signaling pathway (GO:0007189),1/118,0.2908613676790991,0.3246824569441106,0,0,2.97270955165692,3.6710243678482968,RAPGEF2
GO_Biological_Process_2021,positive regulation of cysteine-type endopeptidase activity involved in apoptotic process (GO:0043280),1/119,0.2929300718873854,0.3265171193171436,0,0,2.9473684210526314,3.6188419059575634,GRAMD4
GO_Biological_Process_2021,macroautophagy (GO:0016236),1/120,0.2949928450262469,0.327864696063904,0,0,2.922453191803037,3.567743063887864,CHMP4B
GO_Biological_Process_2021,cytoskeleton organization (GO:0007010),1/120,0.2949928450262469,0.327864696063904,0,0,2.922453191803037,3.567743063887864,NECTIN2
GO_Biological_Process_2021,cellular response to organic substance (GO:0071310),1/123,0.3011457446474932,0.3342195547532872,0,0,2.850158182341098,3.420648494578307,PTPN7
GO_Biological_Process_2021,fatty acid metabolic process (GO:0006631),1/124,0.3031849599911523,0.3355130392985662,0,0,2.8268435315932106,3.37358964486458,PPARD
GO_Biological_Process_2021,defense response to symbiont (GO:0140546),1/124,0.3031849599911523,0.3355130392985662,0,0,2.8268435315932106,3.37358964486458,IRF1
GO_Biological_Process_2021,regulation of phosphorylation (GO:0042325),1/125,0.3052183273277664,0.3367926370513284,0,0,2.8039049235993208,3.3274722891319986,CDKN1A
GO_Biological_Process_2021,cellular response to oxidative stress (GO:0034599),1/125,0.3052183273277664,0.3367926370513284,0,0,2.8039049235993208,3.3274722891319986,STX4
GO_Biological_Process_2021,negative regulation of cell growth (GO:0030308),1/126,0.307245863107407,0.3375748538862498,0,0,2.781333333333333,3.2822709217663366,CDKN1A
GO_Biological_Process_2021,negative regulation of growth (GO:0045926),1/126,0.307245863107407,0.3375748538862498,0,0,2.781333333333333,3.2822709217663366,CDKN1A
GO_Biological_Process_2021,circulatory system development (GO:0072359),1/126,0.307245863107407,0.3375748538862498,0,0,2.781333333333333,3.2822709217663366,CDKN1A
GO_Biological_Process_2021,cellular response to insulin stimulus (GO:0032869),1/129,0.3132936452874473,0.3427486033913954,0,0,2.715734649122807,3.151920643629955,NAMPT
GO_Biological_Process_2021,DNA-dependent DNA replication (GO:0006261),1/129,0.3132936452874473,0.3427486033913954,0,0,2.715734649122807,3.151920643629955,BAZ1A
GO_Biological_Process_2021,positive regulation of macromolecule biosynthetic process (GO:0010557),1/129,0.3132936452874473,0.3427486033913954,0,0,2.715734649122807,3.151920643629955,NAMPT
GO_Biological_Process_2021,positive regulation of canonical Wnt signaling pathway (GO:0090263),1/130,0.3152980187347738,0.3429870798701223,0,0,2.694546443628451,3.1101451932076087,CSNK1D
GO_Biological_Process_2021,regulation of primary metabolic process (GO:0080090),1/130,0.3152980187347738,0.3429870798701223,0,0,2.694546443628451,3.1101451932076087,PPARD
GO_Biological_Process_2021,protein glycosylation (GO:0006486),1/130,0.3152980187347738,0.3429870798701223,0,0,2.694546443628451,3.1101451932076087,MGAT5
GO_Biological_Process_2021,regulation of response to external stimulus (GO:0032101),1/130,0.3152980187347738,0.3429870798701223,0,0,2.694546443628451,3.1101451932076087,IRF1
GO_Biological_Process_2021,defense response to virus (GO:0051607),1/133,0.3212767049483742,0.3485035443507788,0,0,2.632908027644869,2.9895420496088705,IRF1
GO_Biological_Process_2021,transmembrane receptor protein serine/threonine kinase signaling pathway (GO:0007178),1/133,0.3212767049483742,0.3485035443507788,0,0,2.632908027644869,2.9895420496088705,F11R
GO_Biological_Process_2021,positive regulation of response to external stimulus (GO:0032103),1/139,0.3330805725700628,0.359825049872524,0,0,2.51767098906687,2.767854116921132,STX4
GO_Biological_Process_2021,protein modification by small protein conjugation (GO:0032446),2/409,0.3331192844522977,0.359825049872524,0,0,1.714197964197964,1.8843400687241905,FBXW11;UBE2D3
GO_Biological_Process_2021,regulation of cellular component organization (GO:0051128),1/139,0.3330805725700628,0.359825049872524,0,0,2.51767098906687,2.767854116921132,RAPGEF2
GO_Biological_Process_2021,enzyme linked receptor protein signaling pathway (GO:0007167),1/140,0.3350281715650445,0.3608718594136804,0,0,2.499432033320712,2.7332305465166247,LCP2
GO_Biological_Process_2021,transcription initiation from RNA polymerase II promoter (GO:0006367),1/140,0.3350281715650445,0.3608718594136804,0,0,2.499432033320712,2.7332305465166247,PPARD
GO_Biological_Process_2021,chromatin organization (GO:0006325),1/142,0.3389066159101153,0.36453820871004,0,0,2.463730247604828,2.665831712299461,BAZ1A
GO_Biological_Process_2021,receptor-mediated endocytosis (GO:0006898),1/143,0.340837492787438,0.3661023698751782,0,0,2.446256486286138,2.633026887250128,FCER1G
GO_Biological_Process_2021,positive regulation of cytosolic calcium ion concentration (GO:0007204),1/147,0.3485057300644529,0.3738162020803071,0,0,2.378755106945446,2.507447201750075,FPR1
GO_Biological_Process_2021,regulation of cytosolic calcium ion concentration (GO:0051480),1/148,0.3504090496580809,0.3748107940632398,0,0,2.362453753431197,2.4773967994848816,FPR1
GO_Biological_Process_2021,positive regulation of intracellular protein transport (GO:0090316),1/148,0.3504090496580809,0.3748107940632398,0,0,2.362453753431197,2.4773967994848816,UBE2D3
GO_Biological_Process_2021,regulation of G2/M transition of mitotic cell cycle (GO:0010389),1/149,0.3523069043465962,0.3763166933771709,0,0,2.346372688477952,2.447859398223995,CSNK1D
GO_Biological_Process_2021,cellular response to organic cyclic compound (GO:0071407),1/150,0.3541993095818149,0.3772885849637085,0,0,2.330507476745556,2.418823229514225,RAPGEF2
GO_Biological_Process_2021,response to cytokine (GO:0034097),1/150,0.3541993095818149,0.3772885849637085,0,0,2.330507476745556,2.418823229514225,PTPN7
GO_Biological_Process_2021,negative regulation of protein phosphorylation (GO:0001933),1/152,0.3579678329899255,0.380774647834159,0,0,2.299407459044964,2.3622092172625244,UBASH3B
GO_Biological_Process_2021,positive regulation of Wnt signaling pathway (GO:0030177),1/153,0.3598439818253401,0.3822409101547181,0,0,2.284164358264081,2.3346095006298744,CSNK1D
GO_Biological_Process_2021,regulation of intracellular signal transduction (GO:1902531),2/437,0.3627242489851463,0.3847682641168403,0,0,1.601559934318555,1.6241617536014423,ARHGAP18;ARHGAP6
GO_Biological_Process_2021,organonitrogen compound biosynthetic process (GO:1901566),1/158,0.3691442057719892,0.3904996556926828,0,0,2.2108615487763994,2.203273672376564,VAPA
GO_Biological_Process_2021,cellular response to starvation (GO:0009267),1/158,0.3691442057719892,0.3904996556926828,0,0,2.2108615487763994,2.203273672376564,CDKN1A
GO_Biological_Process_2021,positive regulation of protein kinase B signaling (GO:0051897),1/161,0.3746604675029606,0.3957898748862087,0,0,2.169078947368421,2.129460900740847,HBEGF
GO_Biological_Process_2021,heart development (GO:0007507),1/164,0.3801293188924859,0.4010155452052599,0,0,2.128834355828221,2.059101770761792,CDKN1A
GO_Biological_Process_2021,adenylate cyclase-modulating G protein-coupled receptor signaling pathway (GO:0007188),1/165,0.3819418030484629,0.4012740146938707,0,0,2.115746683782627,2.0363787419536328,FPR1
GO_Biological_Process_2021,regulation of neuron projection development (GO:0010975),1/165,0.3819418030484629,0.4012740146938707,0,0,2.115746683782627,2.0363787419536328,RAPGEF2
GO_Biological_Process_2021,negative regulation of canonical Wnt signaling pathway (GO:0090090),1/165,0.3819418030484629,0.4012740146938707,0,0,2.115746683782627,2.0363787419536328,CSNK1A1
GO_Biological_Process_2021,cellular protein-containing complex assembly (GO:0034622),1/168,0.3873480629753814,0.4058435366508771,0,0,2.0774240991700808,1.970294667709124,CHMP4B
GO_Biological_Process_2021,"DNA-templated transcription, initiation (GO:0006352)",1/168,0.3873480629753814,0.4058435366508771,0,0,2.0774240991700808,1.970294667709124,PPARD
GO_Biological_Process_2021,cell-cell adhesion via plasma-membrane adhesion molecules (GO:0098742),1/170,0.3909263889705929,0.4090346958166422,0,0,2.0526315789473686,1.9279054741417192,NECTIN2
GO_Biological_Process_2021,cation transport (GO:0006812),1/174,0.3980215316496041,0.4158918861318313,0,0,2.004766250887334,1.8468892557781884,PANX1
GO_Biological_Process_2021,defense response to bacterium (GO:0042742),1/176,0.4015385793645407,0.4189967784673468,0,0,1.981654135338346,1.8081636095571272,FCER1G
GO_Biological_Process_2021,glycerophospholipid biosynthetic process (GO:0046474),1/177,0.4032895225349358,0.4202528538762967,0,0,1.970295055821372,1.789226037199354,DGKD
GO_Biological_Process_2021,protein stabilization (GO:0050821),1/179,0.4067763189253917,0.4233119416459361,0,0,1.94795978710822,1.7521739128281448,CDKN1A
