Gene_set,Term,Overlap,P-value,Adjusted P-value,Old P-value,Old Adjusted P-value,Odds Ratio,Combined Score,Genes
GO_Biological_Process_2021,organelle organization (GO:0006996),8/420,2.705898388856659e-05,0.0207812996264191,0,0,7.584466019417476,79.76955678688714,VMP1;UBXN2B;VAPA;CSNK1A1;CHMP4B;CSNK1D;STX4;NECTIN2
GO_Biological_Process_2021,regulation of cell junction assembly (GO:1901888),3/27,6.442784571468747e-05,0.0247402927544399,0,0,45.268181818181816,436.8363534746969,PRKCH;RAPGEF2;F11R
GO_Biological_Process_2021,membrane assembly (GO:0071709),3/36,0.00015438335924143848,0.0395221399658082,0,0,32.90743801652893,288.7980355988913,UBXN2B;CHMP4B;STX4
GO_Biological_Process_2021,endomembrane system organization (GO:0010256),5/199,0.00027700960120367115,0.0449114530771513,0,0,9.603190040848084,78.66413164040097,VMP1;UBXN2B;VAPA;CSNK1A1;CSNK1D
GO_Biological_Process_2021,regulation of protein kinase activity (GO:0045859),4/110,0.00029239227263770423,0.0449114530771513,0,0,13.861635220125786,112.79786807675036,CDKN1A;UBASH3B;RAPGEF2;LCP2
GO_Biological_Process_2021,cellular response to cytokine stimulus (GO:0071345),7/482,0.0004699516631396136,0.0451153596614029,0,0,5.625139318885449,43.10477159424735,CDKN1A;IRF1;FPR1;STX4;PTPN7;IL1RAP;CD58
GO_Biological_Process_2021,cytokine-mediated signaling pathway (GO:0019221),8/621,0.0004026339966360679,0.0451153596614029,0,0,5.045089722675368,39.43990115076217,CDKN1A;FCER1G;TNFRSF12A;FBXW11;IRF1;FPR1;STX4;IL1RAP
GO_Biological_Process_2021,establishment of endothelial intestinal barrier (GO:0090557),2/11,0.00044700954794706256,0.0451153596614029,0,0,79.09920634920636,610.0866893648016,RAPGEF2;F11R
GO_Biological_Process_2021,Golgi organization (GO:0007030),4/130,0.0005510806386017772,0.0470255478273516,0,0,11.649617871840094,87.41441527805036,VMP1;UBXN2B;CSNK1A1;CSNK1D
GO_Biological_Process_2021,regulation of bicellular tight junction assembly (GO:2000810),2/19,0.001369232764901,0.0919002608217821,0,0,41.859243697479,275.99912096338653,PRKCH;F11R
GO_Biological_Process_2021,positive regulation of antigen receptor-mediated signaling pathway (GO:0050857),2/21,0.0016752651712304,0.0919002608217821,0,0,37.44924812030075,239.36749802123,PRKCH;NECTIN2
GO_Biological_Process_2021,positive regulation of ubiquitin-dependent protein catabolic process (GO:2000060),3/79,0.0015653718648384,0.0919002608217821,0,0,14.257894736842106,92.1007512397889,RNF144B;CSNK1A1;CSNK1D
GO_Biological_Process_2021,nuclear membrane organization (GO:0071763),2/19,0.001369232764901,0.0919002608217821,0,0,41.859243697479,275.99912096338653,UBXN2B;CHMP4B
GO_Biological_Process_2021,positive regulation of proteasomal ubiquitin-dependent protein catabolic process (GO:0032436),3/79,0.0015653718648384,0.0919002608217821,0,0,14.257894736842106,92.1007512397889,RNF144B;CSNK1A1;CSNK1D
GO_Biological_Process_2021,establishment of mitotic spindle orientation (GO:0000132),2/24,0.0021895208131594,0.0934195546948026,0,0,32.33766233766234,198.03819076650805,UBXN2B;FBXW11
GO_Biological_Process_2021,positive regulation of proteasomal protein catabolic process (GO:1901800),3/86,0.0019969864238162,0.0934195546948026,0,0,13.050821467688936,81.12542043679787,RNF144B;CSNK1A1;CSNK1D
GO_Biological_Process_2021,negative regulation of stress fiber assembly (GO:0051497),2/24,0.0021895208131594,0.0934195546948026,0,0,32.33766233766234,198.03819076650805,F11R;ARHGAP6
GO_Biological_Process_2021,immune response-activating cell surface receptor signaling pathway (GO:0002429),2/24,0.0021895208131594,0.0934195546948026,0,0,32.33766233766234,198.03819076650805,FCER1G;FPR1
GO_Biological_Process_2021,establishment of spindle orientation (GO:0051294),2/30,0.0034125952701803,0.1035712132559447,0,0,25.400510204081638,144.28206600498726,UBXN2B;FBXW11
GO_Biological_Process_2021,regulation of proteasomal ubiquitin-dependent protein catabolic process (GO:0032434),3/102,0.0032425358632561,0.1035712132559447,0,0,10.932782369146006,62.66014429474789,RNF144B;CSNK1A1;CSNK1D
GO_Biological_Process_2021,establishment of mitotic spindle localization (GO:0040001),2/29,0.0031910131140572,0.1035712132559447,0,0,26.34259259259259,151.40185980157577,UBXN2B;FBXW11
GO_Biological_Process_2021,small GTPase mediated signal transduction (GO:0007264),3/106,0.0036136136089328,0.1035712132559447,0,0,10.506090026478375,59.076238084955655,CDKN1A;RAPGEF2;ARHGAP18
GO_Biological_Process_2021,ubiquitin-dependent protein catabolic process (GO:0006511),5/354,0.0035901955029,0.1035712132559447,0,0,5.296264259069038,29.81557715255788,RNF144B;UBXN2B;FBXW11;UBE2D3;UBAP1
GO_Biological_Process_2021,multivesicular body organization (GO:0036257),2/31,0.0036411754660293,0.1035712132559447,0,0,24.523399014778324,137.7098895888601,RAB27A;CHMP4B
GO_Biological_Process_2021,mitotic cell cycle phase transition (GO:0044772),4/209,0.0031635389160039,0.1035712132559447,0,0,7.131707317073171,41.05056351732122,CDKN1A;FBXW11;CHMP4B;CSNK1D
GO_Biological_Process_2021,establishment of endothelial barrier (GO:0061028),2/29,0.0031910131140572,0.1035712132559447,0,0,26.34259259259259,151.40185980157577,RAPGEF2;F11R
GO_Biological_Process_2021,negative regulation of actin filament bundle assembly (GO:0032232),2/27,0.0027690078712777,0.1035712132559447,0,0,28.452857142857145,167.56644964163306,F11R;ARHGAP6
GO_Biological_Process_2021,positive regulation of kinase activity (GO:0033674),3/114,0.0044311763034006,0.1063482312816161,0,0,9.744963144963146,52.80883426780957,CDKN1A;RAPGEF2;LCP2
GO_Biological_Process_2021,Fc receptor signaling pathway (GO:0038093),3/112,0.0042172048757418,0.1063482312816161,0,0,9.924770642201835,54.27442925480958,FCER1G;FBXW11;LCP2
GO_Biological_Process_2021,positive regulation of protein phosphorylation (GO:0001934),5/371,0.0043789949393068,0.1063482312816161,0,0,5.045881018661718,27.40385711229944,CDKN1A;RAPGEF2;LCP2;CSNK1D;PDE8A
GO_Biological_Process_2021,positive regulation of epidermal growth factor receptor signaling pathway (GO:0045742),2/34,0.004368494923651,0.1063482312816161,0,0,22.220982142857142,120.73407868148206,DGKD;HBEGF
GO_Biological_Process_2021,Fc-epsilon receptor signaling pathway (GO:0038095),3/111,0.0041126331267019,0.1063482312816161,0,0,10.017171717171715,55.03125404348445,FCER1G;FBXW11;LCP2
GO_Biological_Process_2021,membrane fusion (GO:0061025),2/36,0.0048876172516927,0.1116766708229971,0,0,20.91176470588235,111.27255319681896,UBXN2B;VAPA
GO_Biological_Process_2021,negative regulation of cellular macromolecule biosynthetic process (GO:2000113),6/547,0.0049440192812264,0.1116766708229971,0,0,4.137850135077492,21.97023249527467,ZHX2;CDKN1A;NFIL3;FBXW11;IRF1;PPARD
GO_Biological_Process_2021,membrane organization (GO:0061024),4/242,0.0053204787887125,0.1167465059923217,0,0,6.132586367880486,32.111399567190844,UBXN2B;VAPA;CHMP4B;HBEGF
GO_Biological_Process_2021,negative regulation of cellular process (GO:0048523),6/566,0.0058230870330381,0.1242258567048145,0,0,3.993543956043956,20.55047664293696,CDKN1A;IRF1;RAPGEF2;CHMP4B;TGFBI;PDE8A
GO_Biological_Process_2021,phosphorylation (GO:0016310),5/400,0.0059994294578463,0.1245286979358381,0,0,4.668497731072367,23.884458780245645,DGKD;PRKCH;GK;CSNK1A1;CSNK1D
GO_Biological_Process_2021,acylglycerol metabolic process (GO:0006639),2/41,0.0063029292367822,0.1251312536235957,0,0,18.226190476190474,92.34738283089771,DGKD;GK
GO_Biological_Process_2021,G2/M transition of mitotic cell cycle (GO:0000086),3/130,0.006380992015619,0.1251312536235957,0,0,8.510379384395133,43.01513138522212,CDKN1A;FBXW11;CSNK1D
GO_Biological_Process_2021,cell cycle G2/M phase transition (GO:0044839),3/131,0.0065172527928956,0.1251312536235957,0,0,8.443465909090909,42.49851674005635,CDKN1A;FBXW11;CSNK1D
GO_Biological_Process_2021,protein dephosphorylation (GO:0006470),3/139,0.0076700552974795,0.1336418742996049,0,0,7.943582887700535,38.68867595410073,UBASH3B;FBXW11;PTPN7
GO_Biological_Process_2021,positive regulation of cell migration (GO:0030335),4/269,0.0076875285571743,0.1336418742996049,0,0,5.50020964360587,26.77587819882439,MGAT5;RAPGEF2;STX4;HBEGF
GO_Biological_Process_2021,Ras protein signal transduction (GO:0007265),3/142,0.0081314423724024,0.1336418742996049,0,0,7.770961412688031,37.3939980945446,CDKN1A;RAPGEF2;ARHGAP6
GO_Biological_Process_2021,epidermal growth factor receptor signaling pathway (GO:0007173),2/47,0.0082172382807397,0.1336418742996049,0,0,15.79126984126984,75.82211536937413,DGKD;HBEGF
GO_Biological_Process_2021,regulation of wound healing (GO:0061041),2/47,0.0082172382807397,0.1336418742996049,0,0,15.79126984126984,75.82211536937413,TNFRSF12A;HBEGF
GO_Biological_Process_2021,cellular response to mechanical stimulus (GO:0071260),2/49,0.0089063413034577,0.1336418742996049,0,0,15.117781155015198,71.37092011036809,IRF1;F11R
GO_Biological_Process_2021,positive regulation of reactive oxygen species metabolic process (GO:2000379),2/49,0.0089063413034577,0.1336418742996049,0,0,15.117781155015198,71.37092011036809,CDKN1A;RAB27A
GO_Biological_Process_2021,regulation of cellular component movement (GO:0051270),2/50,0.0092602829393189,0.1336418742996049,0,0,14.802083333333334,69.30366021141536,ARHGAP18;HBEGF
GO_Biological_Process_2021,positive regulation of fat cell differentiation (GO:0045600),2/51,0.0096204341226282,0.1336418742996049,0,0,14.49927113702624,67.33267063743956,METRNL;PPARD
GO_Biological_Process_2021,regulation of exocytosis (GO:0017157),2/52,0.0099867571525234,0.1336418742996049,0,0,14.208571428571428,65.45171819277833,RAB27A;STX4
GO_Biological_Process_2021,positive regulation of protein localization to cell periphery (GO:1904377),2/52,0.0099867571525234,0.1336418742996049,0,0,14.208571428571428,65.45171819277833,PRKCH;STX4
GO_Biological_Process_2021,positive regulation of protein localization to plasma membrane (GO:1903078),2/52,0.0099867571525234,0.1336418742996049,0,0,14.208571428571428,65.45171819277833,PRKCH;STX4
GO_Biological_Process_2021,positive regulation of protein kinase activity (GO:0045860),3/154,0.0101388555796354,0.1336418742996049,0,0,7.149066827212523,32.82408351546314,CDKN1A;RAPGEF2;LCP2
GO_Biological_Process_2021,positive regulation of phagocytosis (GO:0050766),2/53,0.0103592144891482,0.1336418742996049,0,0,13.929271708683473,63.65508440775292,FCER1G;RAB27A
GO_Biological_Process_2021,peptidyl-serine phosphorylation (GO:0018105),3/156,0.0104989319413063,0.1336418742996049,0,0,7.0549019607843135,32.145532010257405,PRKCH;CSNK1A1;CSNK1D
GO_Biological_Process_2021,nuclear membrane reassembly (GO:0031468),2/54,0.0107377687496855,0.1336418742996049,0,0,13.660714285714286,61.93751413619027,UBXN2B;CHMP4B
GO_Biological_Process_2021,negative regulation of nucleic acid-templated transcription (GO:1903507),5/464,0.0109955267632057,0.1336418742996049,0,0,4.004398405064332,18.06090496722812,ZHX2;NFIL3;FBXW11;IRF1;PPARD
GO_Biological_Process_2021,positive regulation of natural killer cell mediated immune response to tumor cell (GO:0002857),1/6,0.0172763407705115,0.1336418742996049,0,0,69.95438596491228,283.9040901406788,NECTIN2
GO_Biological_Process_2021,regulation of glucokinase activity (GO:0033131),1/6,0.0172763407705115,0.1336418742996049,0,0,69.95438596491228,283.9040901406788,MIDN
GO_Biological_Process_2021,regulation of immunoglobulin mediated immune response (GO:0002889),1/6,0.0172763407705115,0.1336418742996049,0,0,69.95438596491228,283.9040901406788,NECTIN2
GO_Biological_Process_2021,COPI coating of Golgi vesicle (GO:0048205),1/6,0.0172763407705115,0.1336418742996049,0,0,69.95438596491228,283.9040901406788,ARFGAP3
GO_Biological_Process_2021,COPI-coated vesicle budding (GO:0035964),1/6,0.0172763407705115,0.1336418742996049,0,0,69.95438596491228,283.9040901406788,ARFGAP3
GO_Biological_Process_2021,regulation of microtubule motor activity (GO:2000574),1/6,0.0172763407705115,0.1336418742996049,0,0,69.95438596491228,283.9040901406788,FBXW11
GO_Biological_Process_2021,vesicle fusion with endoplasmic reticulum-Golgi intermediate compartment (ERGIC) membrane (GO:1990668),1/6,0.0172763407705115,0.1336418742996049,0,0,69.95438596491228,283.9040901406788,STX4
GO_Biological_Process_2021,stress-induced premature senescence (GO:0090400),1/8,0.0229696971452446,0.1336418742996049,0,0,49.9624060150376,188.5371084691924,CDKN1A
GO_Biological_Process_2021,membrane fusion involved in viral entry into host cell (GO:0039663),1/8,0.0229696971452446,0.1336418742996049,0,0,49.9624060150376,188.5371084691924,NECTIN2
GO_Biological_Process_2021,regulation of myeloid leukocyte differentiation (GO:0002761),1/8,0.0229696971452446,0.1336418742996049,0,0,49.9624060150376,188.5371084691924,UBASH3B
GO_Biological_Process_2021,natural killer cell differentiation (GO:0001779),1/8,0.0229696971452446,0.1336418742996049,0,0,49.9624060150376,188.5371084691924,NFIL3
GO_Biological_Process_2021,cellular response to cGMP (GO:0071321),1/5,0.0144174503390076,0.1336418742996049,0,0,87.44736842105263,370.71702609175657,RAPGEF2
GO_Biological_Process_2021,negative regulation of regulatory T cell differentiation (GO:0045590),1/5,0.0144174503390076,0.1336418742996049,0,0,87.44736842105263,370.71702609175657,IRF1
GO_Biological_Process_2021,T cell extravasation (GO:0072683),1/5,0.0144174503390076,0.1336418742996049,0,0,87.44736842105263,370.71702609175657,F11R
GO_Biological_Process_2021,ubiquitin-independent protein catabolic process via the multivesicular body sorting pathway (GO:0090611),1/5,0.0144174503390076,0.1336418742996049,0,0,87.44736842105263,370.71702609175657,CHMP4B
GO_Biological_Process_2021,positive regulation by host of viral genome replication (GO:0044829),1/5,0.0144174503390076,0.1336418742996049,0,0,87.44736842105263,370.71702609175657,VAPA
GO_Biological_Process_2021,regulation of extrinsic apoptotic signaling pathway (GO:2001236),2/64,0.0148505309064003,0.1336418742996049,0,0,11.451612903225806,48.20808001291636,TNFRSF12A;STX4
GO_Biological_Process_2021,ERBB signaling pathway (GO:0038127),2/66,0.0157425878544849,0.1336418742996049,0,0,11.092633928571429,46.04980116642699,DGKD;HBEGF
GO_Biological_Process_2021,regulation of epidermal growth factor receptor signaling pathway (GO:0042058),2/67,0.0161970717960386,0.1336418742996049,0,0,10.92142857142857,45.02822877860617,DGKD;HBEGF
GO_Biological_Process_2021,endoplasmic reticulum to Golgi vesicle-mediated transport (GO:0006888),3/185,0.0165599885309882,0.1336418742996049,0,0,5.922077922077922,24.285054741621902,VAPA;ARFGAP3;ERGIC1
GO_Biological_Process_2021,alditol metabolic process (GO:0019400),1/6,0.0172763407705115,0.1336418742996049,0,0,69.95438596491228,283.9040901406788,GK
GO_Biological_Process_2021,positive regulation of endothelial cell development (GO:1901552),1/6,0.0172763407705115,0.1336418742996049,0,0,69.95438596491228,283.9040901406788,F11R
GO_Biological_Process_2021,glycerol-3-phosphate metabolic process (GO:0006072),1/6,0.0172763407705115,0.1336418742996049,0,0,69.95438596491228,283.9040901406788,GK
GO_Biological_Process_2021,response to cGMP (GO:0070305),1/5,0.0144174503390076,0.1336418742996049,0,0,87.44736842105263,370.71702609175657,RAPGEF2
GO_Biological_Process_2021,positive regulation of glial cell proliferation (GO:0060252),1/5,0.0144174503390076,0.1336418742996049,0,0,87.44736842105263,370.71702609175657,PRKCH
GO_Biological_Process_2021,beta-catenin destruction complex assembly (GO:1904885),1/5,0.0144174503390076,0.1336418742996049,0,0,87.44736842105263,370.71702609175657,CSNK1A1
GO_Biological_Process_2021,extracellular exosome biogenesis (GO:0097734),1/5,0.0144174503390076,0.1336418742996049,0,0,87.44736842105263,370.71702609175657,RAB27A
GO_Biological_Process_2021,regulation of phagocytosis (GO:0050764),2/58,0.0123122129412566,0.1336418742996049,0,0,12.682397959183673,55.76657850413954,FCER1G;RAB27A
GO_Biological_Process_2021,muscle organ development (GO:0007517),2/58,0.0123122129412566,0.1336418742996049,0,0,12.682397959183673,55.76657850413954,FHL3;HBEGF
GO_Biological_Process_2021,neutrophil degranulation (GO:0043312),5/481,0.012693736239521,0.1336418742996049,0,0,3.8580149040748375,16.84658772794826,FCER1G;VAPA;FPR1;RAB27A;CD58
GO_Biological_Process_2021,protein polymerization (GO:0051258),2/59,0.0127206966303195,0.1336418742996049,0,0,12.459273182957393,54.3788087410781,CHMP4B;ARHGAP6
GO_Biological_Process_2021,autophagosome organization (GO:1905037),2/56,0.0115130193097697,0.1336418742996049,0,0,13.153439153439152,58.72059285932742,VMP1;UBXN2B
GO_Biological_Process_2021,MAPK cascade (GO:0000165),4/303,0.0115404505857537,0.1336418742996049,0,0,4.8663446054750406,21.713128265255843,FBXW11;RAPGEF2;PTPN7;HBEGF
GO_Biological_Process_2021,positive regulation of cell population proliferation (GO:0008284),5/474,0.0119742293671785,0.1336418742996049,0,0,3.917005270145231,17.332742410522606,CDKN1A;PRKCH;NAMPT;STX4;HBEGF
GO_Biological_Process_2021,autophagosome assembly (GO:0000045),2/58,0.0123122129412566,0.1336418742996049,0,0,12.682397959183673,55.76657850413954,VMP1;UBXN2B
GO_Biological_Process_2021,positive regulation of cAMP-dependent protein kinase activity (GO:2000481),1/5,0.0144174503390076,0.1336418742996049,0,0,87.44736842105263,370.71702609175657,RAPGEF2
GO_Biological_Process_2021,neutrophil mediated immunity (GO:0002446),5/488,0.0134421739763741,0.1336418742996049,0,0,3.800734403687644,16.378725979094533,FCER1G;VAPA;FPR1;RAB27A;CD58
GO_Biological_Process_2021,neutrophil activation involved in immune response (GO:0002283),5/485,0.0131178398752196,0.1336418742996049,0,0,3.825078616352201,16.577057440139306,FCER1G;VAPA;FPR1;RAB27A;CD58
GO_Biological_Process_2021,peptidyl-serine modification (GO:0018209),3/169,0.0130201862704401,0.1336418742996049,0,0,6.498138006571741,28.210069795777414,PRKCH;CSNK1A1;CSNK1D
GO_Biological_Process_2021,COPII-coated vesicle budding (GO:0090114),2/70,0.0175939233874627,0.1336418742996049,0,0,10.438025210084032,42.17172718413144,VAPA;CSNK1D
GO_Biological_Process_2021,Fc-gamma receptor signaling pathway (GO:0038094),2/72,0.0185526421777734,0.1336418742996049,0,0,10.138775510204082,40.42474845916997,FCER1G;MYO10
GO_Biological_Process_2021,regulation of actin filament-based process (GO:0032970),2/73,0.0190401430533376,0.1336418742996049,0,0,9.995472837022133,39.59412433945865,ARHGAP18;F11R
GO_Biological_Process_2021,"negative regulation of transcription, DNA-templated (GO:0045892)",7/948,0.0192849693916708,0.1336418742996049,0,0,2.7714988226959223,10.943067085720932,ZHX2;NFIL3;FBXW11;IRF1;UBE2D3;ETV6;PPARD
GO_Biological_Process_2021,regulation of stress fiber assembly (GO:0051492),2/74,0.0195330257721004,0.1336418742996049,0,0,9.856150793650794,38.79034623649447,F11R;ARHGAP6
GO_Biological_Process_2021,Fc receptor mediated stimulatory signaling pathway (GO:0002431),2/74,0.0195330257721004,0.1336418742996049,0,0,9.856150793650794,38.79034623649447,FCER1G;MYO10
GO_Biological_Process_2021,positive regulation of B cell receptor signaling pathway (GO:0050861),1/7,0.0201270821818301,0.1336418742996049,0,0,58.29239766081872,227.6719762446049,PRKCH
GO_Biological_Process_2021,positive regulation of cAMP-mediated signaling (GO:0043950),1/7,0.0201270821818301,0.1336418742996049,0,0,58.29239766081872,227.6719762446049,RAPGEF2
GO_Biological_Process_2021,autophagosome membrane docking (GO:0016240),1/7,0.0201270821818301,0.1336418742996049,0,0,58.29239766081872,227.6719762446049,VMP1
GO_Biological_Process_2021,positive regulation of gliogenesis (GO:0014015),1/7,0.0201270821818301,0.1336418742996049,0,0,58.29239766081872,227.6719762446049,PRKCH
GO_Biological_Process_2021,positive regulation of mast cell activation (GO:0033005),1/7,0.0201270821818301,0.1336418742996049,0,0,58.29239766081872,227.6719762446049,NECTIN2
GO_Biological_Process_2021,regulation of glial cell apoptotic process (GO:0034350),1/7,0.0201270821818301,0.1336418742996049,0,0,58.29239766081872,227.6719762446049,PRKCH
GO_Biological_Process_2021,collagen-activated tyrosine kinase receptor signaling pathway (GO:0038063),1/7,0.0201270821818301,0.1336418742996049,0,0,58.29239766081872,227.6719762446049,UBASH3B
GO_Biological_Process_2021,membrane fission (GO:0090148),1/7,0.0201270821818301,0.1336418742996049,0,0,58.29239766081872,227.6719762446049,CHMP4B
GO_Biological_Process_2021,regulation of natural killer cell mediated cytotoxicity directed against tumor cell target (GO:0002858),1/7,0.0201270821818301,0.1336418742996049,0,0,58.29239766081872,227.6719762446049,NECTIN2
GO_Biological_Process_2021,mitochondrion-endoplasmic reticulum membrane tethering (GO:1990456),1/7,0.0201270821818301,0.1336418742996049,0,0,58.29239766081872,227.6719762446049,VMP1
GO_Biological_Process_2021,negative regulation by host of viral genome replication (GO:0044828),1/7,0.0201270821818301,0.1336418742996049,0,0,58.29239766081872,227.6719762446049,VAPA
GO_Biological_Process_2021,proteasomal protein catabolic process (GO:0010498),3/205,0.0216735270708417,0.1336418742996049,0,0,5.33033303330333,20.424043666357694,UBXN2B;FBXW11;UBE2D3
GO_Biological_Process_2021,regulation of protein localization to plasma membrane (GO:1903076),2/80,0.0226014376854312,0.1336418742996049,0,0,9.095238095238097,34.4686036296462,PRKCH;STX4
GO_Biological_Process_2021,regulation of cell population proliferation (GO:0042127),6/764,0.0228845142310109,0.1336418742996049,0,0,2.920235437385833,11.030590224766453,CDKN1A;IRF1;NAMPT;RAPGEF2;STX4;HBEGF
GO_Biological_Process_2021,regulation of response to wounding (GO:1903034),1/8,0.0229696971452446,0.1336418742996049,0,0,49.9624060150376,188.5371084691924,TNFRSF12A
GO_Biological_Process_2021,forebrain neuron development (GO:0021884),1/8,0.0229696971452446,0.1336418742996049,0,0,49.9624060150376,188.5371084691924,RAPGEF2
GO_Biological_Process_2021,forebrain neuron differentiation (GO:0021879),1/8,0.0229696971452446,0.1336418742996049,0,0,49.9624060150376,188.5371084691924,RAPGEF2
GO_Biological_Process_2021,fusion of virus membrane with host plasma membrane (GO:0019064),1/8,0.0229696971452446,0.1336418742996049,0,0,49.9624060150376,188.5371084691924,NECTIN2
GO_Biological_Process_2021,regulation of alpha-beta T cell proliferation (GO:0046640),1/8,0.0229696971452446,0.1336418742996049,0,0,49.9624060150376,188.5371084691924,IRF1
GO_Biological_Process_2021,regulation of ATPase-coupled calcium transmembrane transporter activity (GO:1901894),1/8,0.0229696971452446,0.1336418742996049,0,0,49.9624060150376,188.5371084691924,VMP1
GO_Biological_Process_2021,negative regulation of glial cell apoptotic process (GO:0034351),1/8,0.0229696971452446,0.1336418742996049,0,0,49.9624060150376,188.5371084691924,PRKCH
GO_Biological_Process_2021,"regulation of CD8-positive, alpha-beta T cell proliferation (GO:2000564)",1/8,0.0229696971452446,0.1336418742996049,0,0,49.9624060150376,188.5371084691924,IRF1
GO_Biological_Process_2021,brown fat cell differentiation (GO:0050873),1/8,0.0229696971452446,0.1336418742996049,0,0,49.9624060150376,188.5371084691924,METRNL
GO_Biological_Process_2021,positive regulation of homotypic cell-cell adhesion (GO:0034112),1/8,0.0229696971452446,0.1336418742996049,0,0,49.9624060150376,188.5371084691924,F11R
GO_Biological_Process_2021,negative regulation of response to reactive oxygen species (GO:1901032),1/8,0.0229696971452446,0.1336418742996049,0,0,49.9624060150376,188.5371084691924,PDE8A
GO_Biological_Process_2021,cellular response to UV-B (GO:0071493),1/8,0.0229696971452446,0.1336418742996049,0,0,49.9624060150376,188.5371084691924,CDKN1A
GO_Biological_Process_2021,positive regulation of establishment of endothelial barrier (GO:1903142),1/6,0.0172763407705115,0.1336418742996049,0,0,69.95438596491228,283.9040901406788,F11R
GO_Biological_Process_2021,Golgi transport vesicle coating (GO:0048200),1/6,0.0172763407705115,0.1336418742996049,0,0,69.95438596491228,283.9040901406788,ARFGAP3
GO_Biological_Process_2021,IMP biosynthetic process (GO:0006188),1/6,0.0172763407705115,0.1336418742996049,0,0,69.95438596491228,283.9040901406788,AMPD2
GO_Biological_Process_2021,positive regulation of natural killer cell mediated cytotoxicity directed against tumor cell target (GO:0002860),1/6,0.0172763407705115,0.1336418742996049,0,0,69.95438596491228,283.9040901406788,NECTIN2
GO_Biological_Process_2021,transmembrane receptor protein tyrosine kinase signaling pathway (GO:0007169),4/404,0.0295965552441177,0.1341824387401377,0,0,3.618888888888889,12.738841011527027,UBASH3B;NAMPT;RAPGEF2;LCP2
GO_Biological_Process_2021,apoptotic process (GO:0006915),3/231,0.0294744843930014,0.1341824387401377,0,0,4.716267942583732,16.621214507567323,IRF1;RELT;PPARD
GO_Biological_Process_2021,positive regulation of transport (GO:0051050),2/91,0.0287029079191317,0.1341824387401377,0,0,7.96669341894061,28.28779115048305,FCER1G;RAB27A
GO_Biological_Process_2021,regulation of actin cytoskeleton organization (GO:0032956),2/91,0.0287029079191317,0.1341824387401377,0,0,7.96669341894061,28.28779115048305,ARHGAP18;F11R
GO_Biological_Process_2021,regulation of hydrogen peroxide-induced cell death (GO:1903205),1/10,0.0286306380412391,0.1341824387401377,0,0,38.85575048732944,138.06527849839193,PDE8A
GO_Biological_Process_2021,lipoprotein transport (GO:0042953),1/10,0.0286306380412391,0.1341824387401377,0,0,38.85575048732944,138.06527849839193,VMP1
GO_Biological_Process_2021,lipid phosphorylation (GO:0046834),1/10,0.0286306380412391,0.1341824387401377,0,0,38.85575048732944,138.06527849839193,DGKD
GO_Biological_Process_2021,immunoglobulin mediated immune response (GO:0016064),1/10,0.0286306380412391,0.1341824387401377,0,0,38.85575048732944,138.06527849839193,FCER1G
GO_Biological_Process_2021,regulation of protein localization to centrosome (GO:1904779),1/10,0.0286306380412391,0.1341824387401377,0,0,38.85575048732944,138.06527849839193,UBXN2B
GO_Biological_Process_2021,positive regulation of vasculogenesis (GO:2001214),1/10,0.0286306380412391,0.1341824387401377,0,0,38.85575048732944,138.06527849839193,RAPGEF2
